{
  "schemaVersion": "1.0",
  "artifactId": "art_01JQXK0000000000000000001",
  "kind": "EpisodeBrief",
  "uri": "file:///workspace/artifacts/episode-brief.json",
  "sha256": "a1b2c3d4e5f60718293a4b5c6d7e8f901a2b3c4d5e6f708192a3b4c5d6e7f801",
  "mediaType": "application/json",
  "producerRunId": "run-a",
  "producerStageId": "stage-a",
  "inputHashes": [],
  "reconstructability": "source",
  "createdAt": "2026-01-01T00:00:00.000Z"
}
